{
 "format": "lunarsim-scene-gallery",
 "version": 1,
 "description": "Curated years of the base for the 3D world: each scene is a replay of one simulated year (a lunarsim-scene v1 package under data/scenes/<package>) with headline numbers over 20 seeds of the same settings.",
 "common": {
  "terrain": "connecting_ridge",
  "landing_model": "classical",
  "plume": {
   "keepout_km": 1.0,
   "standdown_h": 0.5
  },
  "autonomy_model": "driving-v1",
  "replay_seed": 3,
  "seeds": 20
 },
 "metrics": [
  {
   "key": "delivered_t",
   "label": "Cargo delivered in the year",
   "unit": "t",
   "digits": 0,
   "flag": "Modelled"
  },
  {
   "key": "delay_prio1_mean_h",
   "label": "Mean wait of urgent cargo",
   "unit": "h",
   "digits": 1,
   "flag": "Modelled"
  },
  {
   "key": "delay_prio1_p90_h",
   "label": "One in ten urgent items waits longer than",
   "unit": "h",
   "digits": 0,
   "flag": "Modelled"
  },
  {
   "key": "sl24_prio1",
   "label": "Urgent items delivered within a day",
   "unit": "%",
   "digits": 0,
   "flag": "Modelled"
  },
  {
   "key": "cost_per_landed_kg_usd",
   "label": "Surface cost per landed kg",
   "unit": "$/kg",
   "digits": 0,
   "flag": "Modelled"
  },
  {
   "key": "blackout_wait_vehicle_h",
   "label": "Rover-hours waiting for Earth",
   "unit": "h",
   "digits": 0,
   "flag": "Modelled"
  }
 ],
 "groups": [
  {
   "id": "phases",
   "title": "Three phases, two job rules",
   "description": "The base as it grows, with each company running its own rovers or every rover taking any job."
  },
  {
   "id": "pads",
   "title": "How far the pads are",
   "description": "The second phase with the shared job rule and the landing pads nearer or farther than the usual distance."
  },
  {
   "id": "earth",
   "title": "Earth below the horizon",
   "description": "The second phase when supervised rovers need Earth in view, with and without a relay or autonomy."
  },
  {
   "id": "fleet",
   "title": "A small fleet",
   "description": "The second phase with fewer rovers."
  }
 ],
 "scenes": [
  {
   "id": "p1-inhouse",
   "package": "P1-inhouse",
   "group": "phases",
   "title": "First phase, own rovers",
   "description": "A small outpost; each company drives only its own rovers.",
   "flags": {
    "scenario": "P1-default",
    "phase": "P1",
    "job_rule": "inhouse",
    "pad_standoff_km": 1.0,
    "earth_link": "always",
    "fleet": "default",
    "n_vehicles": 3,
    "landing_model": "classical",
    "plume": {
     "keepout_km": 1.0,
     "standdown_h": 0.5
    },
    "autonomy_model": "driving-v1",
    "terrain": "connecting_ridge"
   },
   "replay": {
    "seed": 3,
    "summary": {
     "delivered_kg": 33746.80032532189,
     "jobs": 70,
     "delay_prio1_p90_h": 40.58856328163511,
     "delay_mean_h": 20.37255102884934,
     "plume_standdowns": 2,
     "offpad_landings": 0,
     "failed_landings": 0
    },
    "gz_bytes": 119897,
    "files": 15
   },
   "headline": {
    "n_seeds": 20,
    "delivered_t": {
     "mean": 33.7388373494,
     "ci95": 1.52550503306,
     "n": 20
    },
    "delay_prio1_mean_h": {
     "mean": 16.3856939736,
     "ci95": 5.87532914938,
     "n": 20
    },
    "delay_prio1_p90_h": {
     "mean": 37.4295219256,
     "ci95": 13.2058358577,
     "n": 20
    },
    "sl24_prio1": {
     "mean": 76.8887085137,
     "ci95": 10.7500080105,
     "n": 20
    },
    "cost_per_landed_kg_usd": {
     "mean": 67664.3996482,
     "ci95": 30533.6385938,
     "n": 20
    }
   },
   "source": "results/gallery_runs.csv, cell p1-inhouse, seeds 0-19 (experiments/phase4/gallery.py headline)"
  },
  {
   "id": "p1-marketplace",
   "package": "P1",
   "group": "phases",
   "title": "First phase, shared rovers",
   "description": "A small outpost; every rover can take any company's job, offered in an auction.",
   "flags": {
    "scenario": "P1-default",
    "phase": "P1",
    "job_rule": "marketplace",
    "pad_standoff_km": 1.0,
    "earth_link": "always",
    "fleet": "default",
    "n_vehicles": 3,
    "landing_model": "classical",
    "plume": {
     "keepout_km": 1.0,
     "standdown_h": 0.5
    },
    "autonomy_model": "driving-v1",
    "terrain": "connecting_ridge"
   },
   "replay": {
    "seed": 3,
    "summary": {
     "delivered_kg": 33596.09833343457,
     "jobs": 69,
     "delay_prio1_p90_h": 3.0818904747067792,
     "delay_mean_h": 31.546522545888998,
     "plume_standdowns": 4,
     "offpad_landings": 0,
     "failed_landings": 1
    },
    "gz_bytes": 121186,
    "files": 15
   },
   "headline": {
    "n_seeds": 20,
    "delivered_t": {
     "mean": 35.4646112463,
     "ci95": 2.19376723161,
     "n": 20
    },
    "delay_prio1_mean_h": {
     "mean": 11.6053816232,
     "ci95": 6.18705184344,
     "n": 20
    },
    "delay_prio1_p90_h": {
     "mean": 25.186512412,
     "ci95": 14.0402429942,
     "n": 20
    },
    "sl24_prio1": {
     "mean": 88.3452380952,
     "ci95": 7.89360874786,
     "n": 20
    },
    "cost_per_landed_kg_usd": {
     "mean": 45451.9788551,
     "ci95": 16979.6169454,
     "n": 20
    }
   },
   "source": "results/gallery_runs.csv, cell p1-marketplace, seeds 0-19 (experiments/phase4/gallery.py headline)"
  },
  {
   "id": "p2-inhouse",
   "package": "P2-inhouse",
   "group": "phases",
   "title": "Second phase, own rovers",
   "description": "A busier base; each company drives only its own rovers.",
   "flags": {
    "scenario": "P2-default",
    "phase": "P2",
    "job_rule": "inhouse",
    "pad_standoff_km": 1.0,
    "earth_link": "always",
    "fleet": "default",
    "n_vehicles": 6,
    "landing_model": "classical",
    "plume": {
     "keepout_km": 1.0,
     "standdown_h": 0.5
    },
    "autonomy_model": "driving-v1",
    "terrain": "connecting_ridge"
   },
   "replay": {
    "seed": 3,
    "summary": {
     "delivered_kg": 512678.6158190654,
     "jobs": 554,
     "delay_prio1_p90_h": 28.487534685105693,
     "delay_mean_h": 12.59576025241543,
     "plume_standdowns": 8,
     "offpad_landings": 0,
     "failed_landings": 0
    },
    "gz_bytes": 179209,
    "files": 15
   },
   "headline": {
    "n_seeds": 20,
    "delivered_t": {
     "mean": 516.046745363,
     "ci95": 4.33897394893,
     "n": 20
    },
    "delay_prio1_mean_h": {
     "mean": 14.8653008611,
     "ci95": 5.07987047914,
     "n": 20
    },
    "delay_prio1_p90_h": {
     "mean": 44.4430216062,
     "ci95": 16.4325807372,
     "n": 20
    },
    "sl24_prio1": {
     "mean": 84.0372626945,
     "ci95": 6.19295298222,
     "n": 20
    },
    "cost_per_landed_kg_usd": {
     "mean": 29330.9566386,
     "ci95": 14199.077825,
     "n": 20
    }
   },
   "source": "results/gallery_runs.csv, cell p2-inhouse, seeds 0-19 (experiments/phase4/gallery.py headline)"
  },
  {
   "id": "p2-marketplace",
   "package": "P2",
   "group": "phases",
   "title": "Second phase, shared rovers",
   "description": "A busier base; every rover can take any job. The reference for the other second-phase scenes.",
   "flags": {
    "scenario": "P2-default",
    "phase": "P2",
    "job_rule": "marketplace",
    "pad_standoff_km": 1.0,
    "earth_link": "always",
    "fleet": "default",
    "n_vehicles": 6,
    "landing_model": "classical",
    "plume": {
     "keepout_km": 1.0,
     "standdown_h": 0.5
    },
    "autonomy_model": "driving-v1",
    "terrain": "connecting_ridge"
   },
   "replay": {
    "seed": 3,
    "summary": {
     "delivered_kg": 530327.860284328,
     "jobs": 545,
     "delay_prio1_p90_h": 5.301873417742718,
     "delay_mean_h": 21.763502498241422,
     "plume_standdowns": 13,
     "offpad_landings": 0,
     "failed_landings": 0
    },
    "gz_bytes": 185252,
    "files": 15
   },
   "headline": {
    "n_seeds": 20,
    "delivered_t": {
     "mean": 532.409765164,
     "ci95": 9.32978604294,
     "n": 20
    },
    "delay_prio1_mean_h": {
     "mean": 6.60577530952,
     "ci95": 2.50945326385,
     "n": 20
    },
    "delay_prio1_p90_h": {
     "mean": 19.4438036555,
     "ci95": 12.8578381085,
     "n": 20
    },
    "sl24_prio1": {
     "mean": 94.1125262652,
     "ci95": 3.21826705119,
     "n": 20
    },
    "cost_per_landed_kg_usd": {
     "mean": 16226.4022734,
     "ci95": 7389.02055064,
     "n": 20
    }
   },
   "source": "results/gallery_runs.csv, cell p2-marketplace, seeds 0-19 (experiments/phase4/gallery.py headline)"
  },
  {
   "id": "p3-inhouse",
   "package": "P3-inhouse",
   "group": "phases",
   "title": "Third phase, own rovers",
   "description": "The full base with bulk cargo; each company drives only its own rovers.",
   "flags": {
    "scenario": "P3-default",
    "phase": "P3",
    "job_rule": "inhouse",
    "pad_standoff_km": 1.0,
    "earth_link": "always",
    "fleet": "default",
    "n_vehicles": 9,
    "landing_model": "classical",
    "plume": {
     "keepout_km": 1.0,
     "standdown_h": 0.5
    },
    "autonomy_model": "driving-v1",
    "terrain": "connecting_ridge"
   },
   "replay": {
    "seed": 3,
    "summary": {
     "delivered_kg": 1582952.0557773896,
     "jobs": 1732,
     "delay_prio1_p90_h": 23.596735387774796,
     "delay_mean_h": 8.311638782858557,
     "plume_standdowns": 25,
     "offpad_landings": 0,
     "failed_landings": 0
    },
    "gz_bytes": 273596,
    "files": 15
   },
   "headline": {
    "n_seeds": 20,
    "delivered_t": {
     "mean": 1564.55586322,
     "ci95": 14.2056989757,
     "n": 20
    },
    "delay_prio1_mean_h": {
     "mean": 8.75310044813,
     "ci95": 1.7789979314,
     "n": 20
    },
    "delay_prio1_p90_h": {
     "mean": 21.435522268,
     "ci95": 7.09143299816,
     "n": 20
    },
    "sl24_prio1": {
     "mean": 91.5610798956,
     "ci95": 3.39272672335,
     "n": 20
    },
    "cost_per_landed_kg_usd": {
     "mean": 13973.0946052,
     "ci95": 10272.889752,
     "n": 20
    }
   },
   "source": "results/gallery_runs.csv, cell p3-inhouse, seeds 0-19 (experiments/phase4/gallery.py headline)"
  },
  {
   "id": "p3-marketplace",
   "package": "P3",
   "group": "phases",